{
  "$schema": "https://json-schema.org/draft/2020-12/schema",
  "type": "object",
  "additionalProperties": false,
  "required": ["version", "engine", "scope", "mutations"],
  "properties": {
    "version": {"const": 1},
    "engine": {"const": "cpp"},
    "scope": {"type": "string", "minLength": 20},
    "mutations": {
      "type": "array", "minItems": 1, "maxItems": 100,
      "items": {
        "type": "object", "additionalProperties": false,
        "required": ["id", "file", "test", "oracle", "before", "after"],
        "properties": {
          "id": {"type": "string", "pattern": "^[a-z][a-z0-9-]{0,63}$"},
          "file": {"type": "string", "minLength": 1},
          "test": {"type": "string", "pattern": "^[a-z][a-z0-9_]*_test$"},
          "oracle": {"type": "string", "minLength": 1},
          "before": {"type": "string", "minLength": 1},
          "after": {"type": "string", "minLength": 1}
        }
      }
    }
  }
}
